tweet_id,user_handle,Comment,Comment Length,sentiment
1,No_Razzmatazz3176,"I can’t wait to vote for Harris/Walz!!
Already have my ballot filled out and am bringing it to my township office this week. 💙",126,
2,nogooduse,"Seems odd to pretend that there's any serious question about who to vote for in Nov 2024.  All the usual stuff about experience, qualifications, debating style, even sincerity - quite irrelevant in this election. It's nearly unbelievable that there should be any questions at this point. Harris is a normal, non-toxic human being.  Her opponent is not.  He has promised to end the American system.  Those are the choices.",421,
3,Illustrious-Host-987,I’m sorry but I fail to understand? In what world is Harris president material based on policy and achievements?,112,
4,PsychologicalCrew307,"So, this may have been posted before, if so, forgive me.

Are the MAGA morons aware of the irony of a FIVE TIME DRAFT DODGER wanting an undrafted woman to face a firing squad for not having battle experience?

Is there absolutely no reality in their world?",256,
5,StormEmergency4387,"If trump doesn't win there will be a revolution and at worse a civil war.

If not we suffer for all of this countries existsnce moving forward. If you are born citizen. Legal, or even have a half functioning brain you'd realize the democrat party has done nothing for you. 

If ypu fight for more laws ypu are anti freedom. Let's fight the overlords together by rejecting their words and morals. Best of luck to you.",416,
6,sol_air_dude,"I'm an independent who believes balance is essential in order to maintain a happy and peaceful life. This is apparent in almost everything throughout the universe. For every action there's an equal and opposite reaction, yin and yang, dark and light, life and death, etc. 

I was not a Trump supporter in any way before he ran for President, when he ran or when he won. I personally wanted Bernie Sanders to win because I believed he truly had the average Americans best interest at heart and would be willing to work with politicians to make this happen, realizing that compromises are sometimes the best way to a resolution. Instead we got Trump.

I always thought his accomplishments as a businessman were over exaggerated, his failures ignored. The way he was on Twitter 24 hours a day posting the most immature and ridiculous things along with his views on foreign policy, domestic policy and national security, I fucking hated it. The way he made his fathers ""small loan"" of, anywhere from 1-60 million dollars (can't find the actual figure anywhere)  seem insignifican to his success bothered the hell out of me. All of these things made me view Trump as President in a very negative way. 

Then this current administration took over. Things went from being pretty good overall, besides Covid, to ok, to bad, to now. Eggs went up to almost $10 in places. The border is out of control, a Venezuelan gang is spreading and taking over parts of the country like a cancer and the administration and their media lackeys are serving disinformation by the handful. Joe Biden aged drastically and suffered the early stages of dementia; and somehow Kamala Harris was exempt from the election process to become the Democratic nominee when Robert Kennedy had spent the last year advocating, campaigning, getting over a million signatures for him to meet these requirements to possibly get nominated and just when he had the chance, his own party sabotaged him and provided the gift that never stops giving (to illegal immigrants) Kamala Harris. 

I didn't know much about her at first. So I did a lot of research, wondering why isn't she willing to do any interviews. That's odd. 

Then I figured out why. She's not who she's pretending to be. She's disingenuous, power hungry, tyrannical, unqualified and dishonest. Her record as a DA is presented as a massive success on her website and by the biased media, but nobody outside of certain venues talk about the wrongful charges and imprisonment against innocent people, withholding evidence to overturn and free an innocent man from death row, putting a single mother in jail for a year because her daughter was hospitalized due to sickle cell anemia. Her ""humble "" beginnings, her delusions of granduer and her wharped views of racial segregation she never experienced the way she portrays. She isn't black. Not even a little bit. The way she is always pandering to whatever group of people she is around, her multiple accents when around white, black and Hispanic people....her lack of commitment to any policy while campaigning besides ""Trumps a danger to democracy"" while at the same time wanting to regulate speech because it's a hindrance to implementing certain things, mitt Romney and Hilary believe the same...her lack of compassion during Hurricane Helene, her wanting to get into the spotlight during hurricane Milton...her overall tone when speaking, her cackle, her mocking and insulting peoples faiths...her saying she knows about parenting because she became a step mom to two already grown adult ""step chidren"" (j think one was a senior or junior in high school, the other an adult)....all these obviously bought (possibly black mailed) celebrity endorsements as well as being endorsed by celebrities who are directly tied to P Diddy as his closest friends in his close circle who attended his ""Freak offs""  the same 9 Diddy who is being charged with SA and trafficking of minors and was an evil version of Bill Cosby (says alot)

Why the fuck would anyone ever vote for this woman? Trumps is no golden goose, I admit that. But he is a million times better than the other option, it's not even close.",4162,
7,Character-Ad2795,I am so excited for yall to experience reality again for the next 4 years,73,
8,Superb_Writing_5726,Support Harris for fresh ideas and social justice! Join me on SugarDaddyMeet with code: SDM7 and meet amazing folks!,116,
9,Effective-Plant290,"Until Harris stops lying and fear mongering to get voters. I will never support her.
Supreme Court ruled on abortion NOT TRUMP.
So one, she cannot over turn that decision. No president can. And two, a DEMOCRAT was the last to make the decision push the law through.",265,
10,gfrancism,"The smart vote is for the Green party if you believe U.S. unchecked support of israel genocidal and suicidal measures iare utterly immoral.

Don' t fall for the Dems scare tactics and the other side is as stern in its unbridled support of Israel.

Don't think this has no impact on the U.S., it always has and with the 2 party system it always will.

Even if you think it willhave no direct impact - think how our privacy rights have been trampled inthe last 3 decades.  What reasoning allowed that to infest our principle ... to compromise our principles.  It's the Us/them mentally.  That is notoriously hard to fight, as it is so esay to go in that direction.  Ask yourself: Why?

Vote a new party.  Don't ask for a multiparty system ...  CREATE IT!
And if you are a worker and feel your craft, your trade is not prized and highly regarded, as in pay - then neither the dems or the repubs have your back.

Try to think for youself without the election noise influencing you in 1 day to erase all the days before.

Are we the people of this nation afraid to do the hard work?

Thank you.",1089,
11,SnooWalruses9171,[damn](https://ref.bumble4.com/kayman37),40,
12,Entire-Ticket3155,L,1,
13,UnlikelyFunction652,I saw none of this from her….,29,
14,LuvSandoz,"This aged well........NOT, LOL",30,
15,mysticalmidwife14,No way you're serious. You're probably CIA.,43,
16,Uva_Be,"We have our Voters pamphlet and are waiting for our ballots. Just a few more days now. 

Also, there are some scary close races down the ballot. When voting in the primary, I didn't worry about leading Democrats making it to the November contest, but I was wrong on a couple very close, very important jobs that directly affect my families day to day lives. Everybody, pay attention to your local races!  For example. Washington State is the Evergreen state. Trees are a VERY, VERY big deal in Washington State and the race to get on the Nov ballot to save trees was between 49 - 51 votes! Squeeeking close! I am happy to see the Health Insurance Commissioner I voted for in the Primary is on the ballot. Access to healthcare is a giant quality of life issue. Just mentioning it as two examples on our WA State ballot. 

Everybody, know who on your ballot will directly impact your family and quality of life in your local area!",928,
17,MBlizzy,lol hold that L,15,
18,Subject-Ad-4937,How did that work out for u?,28,
19,rfill01,How did it work for you? Just sit in the cornet and cry,55,
20,mysticalmidwife14,This aged like sour milk! 🤣🍼,28,
21,Uva_Be,"Totally, both Harris and Waltz are normal, non-toxic humans who will sincerely do their best for the American people, and work to uphold the constitution. 

Too much said about the other guy. I'm so sick and tired of everything he represents, and says, and how he dances. etc...",278,
22,SnooWalruses6812,"The choice is obvious. It’s perplexing how the race could be close at this point, but it is. The future of our democracy is a coin toss. I’m not coping well with the possibility that my granddaughter might grow up in a dystopian dictatorship, that I will lose my Social Security benefits upon which I rely, that young women will die in hospital parking lots, and that the primary purpose of government will be retribution against one man’s perceived enemies. If the despicable creature wins, how will we manage? What can we do? What will become of us on the world stage?  Does anyone have any coping strategies to employ, even now, when the suspense is so great? I’m not sleeping well.",685,
23,,"I really don’t understand. You had your vote taken from you, I assume you were voting for Biden? Then the least favorite VP was installed. None of you voted for her. Why is she all of a sudden the most qualified? 🤔 Policy wise what has she done? I mean maybe I’m missing something? 🤷‍♂️",286,
24,Effective-Plant290,No she is a liar. And I don't trust her. I d not want someone in the White House is fact ad only cares about immigrants. She made mistakes with the choices on the border and won't even admit it. She keeps lying saying Trump passed the abortion no. The Supreme Court did. Her campaign has been I'm going to overturn that when she CANT. By law.,342,
25,Midwest_genxr,Well you all put him there you god damn fools. You’ve damned so many people in the vein of preserving a “republic”,114,
26,LuvSandoz,"He wants her to do what SHE wants others to do, it's that simple and logical........",84,
27,Uva_Be,"I'm an independent leaning voter by the way.

This? ... I'm sorry you are so afraid. Fear is the mind killer.

My gut says, best to not reply.

I'll just say, I've done a lot of research over the past decade or so, a lot of reading since the housing crash, 2009 for politics related to banking. Many subjects years earlier than that. The history of garbage, the American healthcare system, etc... to name a few. The so called overlords doing the oppression of freedom are international corporations and billionaires who run them, and the law we need to get rid of most is Citizen United. Follow the money. Ask the dead. Who has done what for whom?

The US government? They are human like the rest of us. The country is suffering a lot. I agree. There is almost no middle class anymore. The space people have to live in per capita is smaller and costs 2 to 4 time as much as it did a decade ago. I hear people asking, ""where are all the artists? where are the writers?"" That silence speaks as the only answer. Actors in our hit movies and TV shows increasingly hired from Canada, the UK and Australia, because American actors can't compete while holding down a day job. Jobs both high and low, disappearing to Ai.

What has government done for me lately? My family's insurance premium has been cut by 3/4 from what it was at it's height, in 2020. We got a $725 back owed Amazon credit because of a banking anti-discrimination law passed by Democrats. Those are the first two major things that come to mind.

I think I'll stop now. But, I'll just add one more thing. I'm betting against a civil war for one reason. Women. Women voters, grandmas to all the teenagers who get to vote for the first time this election. If you love women, then don't vote for hate or out of fear. Vote for a possible future peace.",1807,
28,nogooduse,"Love the way you threaten violence right out of the gate.  Overlords?  That would be the Koch Bros, Elon, Theile, Trump, etc.

I've voted GOP since the 1960s - until Trump.  A totalitarian criminal will never get the vote of intelligent, honest, decent people.",260,
29,Picapica4,"Republicans that endorse Kamala:
Geraldo Rivera
Liz Cheney
Dick Cheney
General Miller
General Steve Anderson
Anthony Scaramucci
Olivia Troye (national security official)
Adam Kinzinger
Stephanie Grisham
Geoff Duncan
Alberto Gonzales
17 former staff members of Reagan
Over 200 former Bush&Mccain&Romney staffers endorse Harris (source: Fox, btw)

Republicans who won't endorse Trump:
Mitt Romney
Mike Pence
George w Bush
John Kelly


More than a dozen former Trump administration officials signed on to an open letter backing comments from former White House chief of staff John Kelly in which he said former President Trump met the definition of a fascist and expressed admiration for Adolf Hitler. (The Hill)


How many democrats have endorsed Trump? 4?


Trump, and Vance, both keep denying the election result. With zero evidence. And there are big consequences of these lies, as so many Trump voters swallow it with pride. They are denying the wish of 81 million Americans.



Covid was harsh on everyone. The inflation graph looks almost exactly the same for Europe as for the US. Blaming Biden's administration for high prices isn't right.",1145,
30,LuvSandoz,pedo......,10,
31,Effective-Plant290,Yet you're voting for Kamala? Have you seen how horrible California is?,71,
32,No_Razzmatazz3176,"Yeah, we really are going through it since Jan 20th. Wish Harris would’ve won. Too many ignorant people in this country.",120,
33,No_Razzmatazz3176,I’m not crying. I’m fine. 🤷🏻‍♀️,31,
34,No_Razzmatazz3176,Why? I didn’t say they were going to win I just said I was excited to vote for them…. I wouldn’t expect a Trump supporter to understand that though,147,
35,Effective-Plant290,"I hate what Kamala represents. Uniformed voting. If you genuinely study the facts about her and her policy IDC how ""normal"" she comes off. She going to continue to ruin this country. Even Joe Biden isn't supporting her. What about the 32 incident where she said the same word for ten minutes. ",293,
36,Natick1957,"We live in terror of the Orange Retrovirus getting back in office. My husband and I are on SSA Retirement and Medicare, and our autistic adult son is on SSI and Medicaid. (Luckily, he also has commercial insurance). We are slowly building a nest egg for him, but it will never be enough. 
We also have a daughter. I can’t bear the thought of a nationwide abortion ban. When I was 13, my mom sat me down and told me if I got into trouble, tell her right away, so she and my dad could take me to Puerto Rico or Sweden. I had only played Spin the Bottle, but I knew what she meant.
I was 16 when Roe went into effect. I never, ever thought that we would go back to having to travel overseas (if you were lucky enough to afford it), or to DIY abortions, like Nirvana’s “Pennyroyal Tea”. 
The Short Fingered Vulgarian will turn our country into an impoverished, Evangelical Christian hell, where billionaires, tech bros, and corporations will kill off the rest of us, literally and figuratively. 
This is the week from HELL. 
I feel so grateful to Reddit and its community for giving me a safe place to vent. Thank you ❤️",1116,
37,Effective-Plant290,"This whole voting for Kamala just because its not trump is idiotic. As far as I'm concerned, I believe anyone voting for her is uninformed.",139,
38,nogooduse,"Well said: The so called overlords doing the oppression of freedom are international corporations and billionaires who run them, and the law we need to get rid of most is Citizen United. Follow the money.  It makes no sense to blame the gummint for the unbridled greed of billionaires and the SCOTUS ruling(s) that allow that greed to control our country.",355,
39,Entire-Ticket3155,L bruh,6,
40,Realistic-Swing-9255,LOL! And here's to Overlord Trump!!,35,
41,LuvSandoz,"Every name you typed here are swamp, those America needs to be rid of, corrupt, all of them became rich from politics. Trump is the only politician in American history whose wealth DECREASED while in office!!",208,
42,sol_air_dude,"So....I think the evidence of what happened this election. Now that there was a conscious effort to keep election interference and fraud at a minimum, and it was a landslide. 

Also, the American government sent a letter to Venezuelan voters about the results of their recent election, saying that they were actually wrong and was a glitch in the voting machines. Apparently, the person who ""won"" did so in the most unexpected come from behind way possible.

And one thoughtful person wanted to look at the bar graph of the so called glitch and overall election results. Guess what?

They're exactly identical to the voting results in Georgia....where Biden came from way behind and won. 

Look, I'm not a Trumo supporter. I definitely think he's the much better option that Kamala Harris, who literally fucked her way into the white house. Either by actually rucking people, or fuckjng people over.

And im not sure why you're telling me all the Republicans who supported Kamala? That proves one thing to me, as does all the celebrities endorsing Kamala (whom she paid a lot of money)  these people are part or the Status Quo that has kept America In a perpetual and unwinnable war against terrorism, which is really just an excuse for globalization. 

These are the same people who want the W.H.O. to accomplish their mission of lowering the world population. These people are literally trying to destroy free speech (Romney, Hillary and Kamala specifically) and they paid Eminem to endorse her...or blackmailed him. I don't know. Watching someone who became a extremely wealthy individual by exercising his right to free speech endorse a person who is working with others in her party to censor and remove any speech they deem as hateful or misinformation......but hey. She's a woman who may or may not be black, and she's not Donald Trump or Joe Biden, and apparently the process of becoming the presidential nominee doesn't apply to her. She's just special.... so special that she wasted 


A BILLION FUCKING DOLLARS ON PROBABLY THE WORST CAMPAIGN EVER, AND SOMEHOW ENDED UP 20 MILLION DOLLARS IN THE HOLE! She did this in 3 fucking months. 

Imagine what the economy would look like in 3 months with her dumb ass running things",2233,
43,Superb_Writing_5726,Do you have any evidence?,25,
44,Picapica4,https://m.youtube.com/shorts/zrJFWSF93u0,40,
45,Effective-Plant290,Oh you and your husband are going broke under Kamala good luck,62,
46,Uva_Be,"Thanks :)

Well, one POTUS ""sorta"" had a hand in the SCOTUS's attempting to puppet from there. 

Made me look up Gummint. I'm ah, words, I only found Gummite is a yellow amorphous mixture of uranium minerals, oxides, silicates, and hydrates of uranium, derived from the alteration of uraninite. It is named for its gum-like luster. Me thinks you meant government? 

I'm sorta in the spectrum NOS and I have a unique ""filter"" of data. It's um... a good thing most of the time. But, I'm slow with a lot of jokes.",510,
47,Picapica4,"That might as well be because he is bad at business. He failed two casinos because he started them close to each other so they were competing against each other. There are no real signs he is an unselfish person. Quite the opposite. 


Not all people who Trump claim is corrupt really is. Trump is the least trusted source in politics ever. Additionally, Trump sent covid testing devices to dictator Putin when they were needed in america ffs so who is corrupt",460,
48,Picapica4,"She did not fuck herself into her position. That is a sexist republican lie. She is a lawyer ffs. We need more of highly educated people in office.


War against terrorism an excuse for globalisation? Wtf are you on about. Globalisation is not bad, that's also some lie I don't know where you get from? There are several examples in history where protectionisms fuck up countries much more than globalisation ever has done.

""I think evidence"". No you don't. Evidence is provided by trusted sources. I don't know what breitfart you get ur weird claims from.

Don't tell me about dems wanting to end free speach. That's also some dumb parroting from Trump supporters. Trump has literally threatened to put people who disagree with him in jail. And he didn't accept when the american people democratically didn't elect him.",821,
49,sol_air_dude,"Lol. The wanting to end free speech literally came directly out of Mitt Romneys mouth and was confirmed by other democrats who are against taking away our 1st amendment right. 


No, globalization isn't bad when it's wanted by the people living in the country being globalized, but when people are having their homeland invaded by a foreign military, being bombed, having foreign defense contractors come in along with foreign corporations to come in and rebuild it to suit THEIR desires instead of the people of the land who grew up and live there...yeah, that's a problem. That's one of the main ingredients in creating a terrorist. 

Kamala Harris being a lawyer and being highly educated doesn't mean she's highly intelligent. There's  a huge difference between being able to solve problems consistently VS being able to pay a school to allow you to graduate from their University while charging you an absurd amount of money. Money that the majority of people will spend 10-20 years or more paying off. 

Of course, I'm sure her ""middle class"" family had no problem paying for anything in her life.

Btw, Kamalas record as an attorney is a disgusting despicable disgrace. She should be disbarred. Withholding evidence that would free an innocent man and needing to be ordered by a judge to release that innocent man, and still taking an exuberant amount of time to do so, that is blatant abuse of her power as lead prosecutor.",1431,
50,Picapica4,"Free speech:
https://eu.statesman.com/story/news/politics/politifact/2024/10/04/the-context-behind-vances-claim-that-harris-engaged-in-widespread-censorship/75513146007/

Idk what foreign military invasion has to do with globalism. Globalism didn't cause Putin to invade Ukraine without a legitimate reason.

Romney said that Harris showed she's an intelligent capable person. And she has shown she is able to learn quickly, relative to Trump who on the other hand doesn't even like to read. And he's lost all the money his papa gave him.

 We are talking about the worse option here. Going through law school doesn't make you a God that makes no mistakes, and having parental support makes a huge difference, no question, but it does show that you have worked your ass off, not just watching tv and believing haitians eat pets and even go on adamantly claiming that in front of millions of people without a second thought.

On the inmate:
https://www.politifact.com/factchecks/2020/oct/09/viral-image/harris-didnt-frame-and-prosecute-man-murder/

Talking sense to Trumpsters and conspiracy theorists is a 9-5 job. I hope you appreciate this effort to dig into things. The election in 2020 was fair. I hope your eggs are worth this round.",1238,
51,Uva_Be,"This seems like so much is on the line. 2020 felt like, meh, just more of the same, two old white men choose the one who is more Star Trek versus Mad Max. ... Then as we all know it looked like 2024 was just a repeat. 

Now? What do you think about what happened to Katie Porter? And or California in the primary.",313,
52,ViejoMac,"We’re probably on opposite sides of the political spectrum but we agree at least on one point:  the political process in WAAAAAAAY to long, and stressful. Seems like politicians begin campaigning soon as they’re elected.  They spend so much time trying to KEEP their job, they forget how to DO their job.",304,
53,Just_lurking_toad,I'm already in over my head with stress. I've been having panic attacks and a resurgence in self harm impulses and SI. Election session with Trump on the ticket are the only time I've struggled like this and every time it gets worse. I've ways of dealing with other forms for stress but no amount of mindfulness is going to change the fact that if he or protect 2025 come to be I'm literally materially fucked.,410,
