tweet_id,user_handle,Comment,Comment Length,sentiment
265,ReasonableGap7912,Religious yes. Nazi no I hate em. Love America. And believe it's the greatest nation ever conceived. Democracy doesn't work we proved that in the Jim crow era. Liberty is what we should be concerned with. And I really don't understand how any of this makes me a racist. I believe Jesus loves every race on earth. And so do I,324,
266,ReasonableGap7912,And why is Trump a racist? I mean you do realize he donated 200k to Jessie Jackson when he ran for president as a democrat,122,
267,ReasonableGap7912,I bet he runs and wins. Don't get me wrong he is a asshole. But his policies were great. And working. Personally I'd love to see John Kennedy run. Or Ted Cruz. Anybody that doesn't have a socialist agenda. Or a bullshit climate change agenda.,242,
268,Uva_Be,"There's a lot in this post. 

We need new progressive leaders to replace these old ideas. Biden saved our pathetic asses from 2020s pandemic voting nightmare. I mean do we even know how many people got COVID and died BECAUSE they had to vote in person? Just look at the spike of deaths after November. We can do better than compromise in 2024.

Ukraine is too tragic and horrible to call it ""giving Putin a bloody nose"". Sorry, we have to get rid of our dependence of fossil fuels. It's not a fight the world can survive climate change, and pushing towards WW3 is ... it's not a ""fight"" anyone or anything alive wins.

Get rid of Manchin, we need to find someone better, not settle. 

This is a quote from Newsweek 

The co-founders of the No Excuses PAC are searching for candidates to run against the pair since both Manchin and Sinema are up for re-election in 2024.

They are the same PAC that got AOC elected. We can do better than Biden/Harris, in 2024.",959,
269,TargetNo9243,Hell no….. dem is fuccking up themselves big time!!,51,
270,reincarnateme,"Has anyone watched this:

https://www.vice.com/en/article/43n8pm/watch-the-entire-cyberwar-episode-on-hacking-the-us-election",125,
271,Crafty_Extension7334,"Seriously? 

“Today is today. And yesterday was today yesterday. Tomorrow will be today tomorrow. So live today, so the future today will be as the past today as it is tomorrow.” 


“ You think you just fell out of a coconut tree…You exist in the context of all in which you live and what came before you.”",306,
272,ReasonableGap7912,Oh yeah and I don't want to stick it to the libs I myself am a libertarian. Oh and for the record I support gay rights trans rights and I am a 45yr old white male and voted for democrats for 20 plus years but they have it all wrong now socialism doesn't work i promise you I've studied it for 20yrs was a supporter for 20yrs and it never works,343,
273,ReasonableGap7912,Not at all. Democracy is just the majority like in the south in the early 20th century. Black people would never get any rights because they were never the majority even when allowed to vote,190,
274,ReasonableGap7912,Women have no rights over their own bodies. Please they just need to be responsible for their actions.,102,
275,ReasonableGap7912,So you think I'm sitting here in TN and supporting putin? Come on man,69,
276,ReasonableGap7912,Democracy is OK its just not perfect is all I'm saying.,55,
277,ReasonableGap7912,They have the right to say no,29,
278,ReasonableGap7912,And less than 1%% of abortions are a product of rape,52,
279,ReasonableGap7912,Democracy how is that working out for women in the Islamic world?,65,
280,,you dont have to be religious to belive that killing preborn babies is bad,74,
281,Smart_Yogurt_989,Why didn't Biden keep many of his campaign promises?,52,
282,TargetNo9243,No no no trump 2024! He will beat any of them!!,47,
283,TargetNo9243,Fuccck democrats! The way they are doing? Look at nyc or LA or wherever blue states are doing. If im rich i wanna get the hell out of blue states too,149,
284,Looney_bin_666,"Biden has made too many empty promises. The main reasoning I've heard as to why people voted Biden is ""at least it isn't Trump"". However, I think America would be in a better spot if Trump was still in office. If anything, I don't see the bettering of healthcare or education anytime soon, no matter who's in office.",316,
285,Think_Equivalent_832,We need a president who has our country's best interest at heart and is loyal to our constitution.  He pledged he would and should.,131,
286,Lazy_Gringo3,"The nation is now deadlocked and gridlocked, 45-45 or 50-50. Neither side has any advantage except the gerrymandered districts by then GOP. if they win the House they will likely lose the vote, so very undemocratic. However Dems are now favored to add senate seats, so the Maga clowns and traitors would take over the House and waste time running a lot of bogus investigations and defunding Ukraine for their master Putin while the senate would block anything they do, as would Biden.

Attention then turns to the states.  The conventional wisdom is that Desantis and Abbott are somehow unbeatable, but in fact they are both very beatable and victims of the same 45-45 50-50 situation.  Neither TX nor FL is really a red state, FL definitely purple and TX almost purple.   Therefore those two governors races are up for grabs by democrats if they can harness the momo and get turnout to record highs. If so, then dems and Carlie Crist could knock off desantis before he even has a chance to run for president.

In both TX and FL, Desantis and Abbott have less than 50% support, around 47-48%. But they also have more than 47-48% who disapprove of them and around 45% who strongly disapprove of them.   So any wave of good vibes by Beto and Crist can do the trick. Desantis is now stuck and unwilling to ban abortion as he promised the religious right, l but everyone will know he's going to do it if he wins.  Polls show that 10% of voters plan to vote with abortion as their #1 issue, and those are all pro choice voters.  That right there could make the difference.

Also, Trump is now the least popular politician. He is less popular than Biden and less popular than the generic Republican.  So he will be a drag on the party especially if the GOP nominee is endorsed by trump.",1780,
287,Immediate-Assist-598,"liar, stop trolling me.",23,
288,Realistic_Flight08,As a democrat I agree,21,
289,Smart_Yogurt_989,"Why didn't biden keep his campaign promises. I feel cheated. No student relief, oil drilling, smh...",100,
290,Lazy_Gringo3,"LIAR, democracy works unless the far right or other extremists sabotage or steal it.  That is way happened on january 6th and back in 2016 with Putin's interference campaign too. 

Without a fair and free democracy the USA and everything it stands for ceases to exist. Jim Crow was an attempt by the racist far right to sabotage and steal democracy. It was extreme voter suppression aimed at blacks and went on for a very long time before democrats fixed that.

LIberty or freedom is the last thing the rightwing wants, or is willing to give. Look at Putin in Russia, their role model now. Who has liberty there?  No one.  No liberty, no justice, no democracy, you cant even express yourself without risking getting thrown in prison or worse. That is fascism/. Fascism and Nazism are the same thing, totalitarian evil.  Not to mention 100% dishonest and at war with any inconvenient facts.    Also, fascism and Nazism (see Trump, Putin etc) always depends on racism. Attacking the immigrant, the darker race, the poor, the gays, the Jews, college students, the outsiders.    and of course keeping down women, that is always a big part of it.  Women they believe are meant to be seen not heard and are property of the men, including girls as young as 12.  The TN GOP just tried to (and maybe did) pass a law making it legal for old men to marry 14 year old girls.  and removing abortion and contraceptive rights really makes them slaves of the male dominated government.  Women have no rights over their own bodies, nor even to call forced sex rape, and that is the way fascists like it.",1586,
291,Immediate-Assist-598,gimme a break. trump is a total racist. he hates even seeing blacks or latinos. at his casino they told them all to stay out of sight if he wss in the house. he wss found guilty of housing descrmination. he will talk to black celebrities though.,245,
292,Lazy_Gringo3,"So you are a religious right extremis bigot and fact-free anti-patriot who doesn't care of Putin and the USSR II rule the USA and democracy is no more.   And you are willing to vote for a total asshole just to ""stick it to the libs"", huh?    

You clearly do not love or respect your country or value democracy.  Maybe you need to move to Russia, see how you like a neo nazi dictatorship run by another total asshole.  John Kennedy btw went to Moscow three years ago with a ground of Republican senators and they all came home parroting Russian propaganda. They had to be advised by the FBI to cut it out.  as for Ted Cruz, well even tbhouogh the GOP knew Trump was a Russian agent in 2016, they chose not to block him because ted Cruz was in second place and they would have to give the nomination to him, such a huge asshole that they actually prefered the Russian agent.",873,
293,nogooduse,"**Iran made a fool of Trump**

In 2015, Iran agreed to surrender 97% of its uranium, but Trump pulled out of that deal in 2018, and Iran returned to developing weapons-grade uranium.

Iran fired missiles at US troops in Iraq, injuring over 100 Americans. Trump pretended it didn't happen, then said no one was injured. He took no action against Iran.

**Putin made a fool of Trump**

Putin put bounties on US soldiers in Afghanistan; dozens were killed as a result.  Trump did nothing – didn't even complain to Putin.

Trump told Putin to go ahead and invade Europe.

**The Taliban made a fool of Trump**

Trump freed top Taliban leaders in exchange for nothing.

Trump then gave Afghanistan to the Taliban. Literally.

**Kim Jong Un made a fool of Trump**

NK doubled their missiles & nukes on Trump's watch.

**Mexico stood up to Trump**

Trump couldn't even get Mexico to cooperate on the wall, let alone pay for it.

**China called Trump's bluff**

Trump's trade war with China cost the US 250,000 jobs, billions of dollars, gained nothing.",1053,
294,nogooduse,Biden is to the right of Eisenhower and you call the Dems 'socialist'?,70,
295,rfill01,"You forgot about “before you documents were physically on your computer, and now they are in the cloud ( in the sky)",116,
296,Lazy_Gringo3,"The Libertarian party has been property of Putin for years. he paid off Rand Paul and his father a long time ago and now Libertarian websites are filled with Russian trolls spouting the same old Putin fascist disinformation.   In 2016, Putin bought and took over the Green Party too, though only corrupt fake liberal candidate Jill Stein knew it was happening. That was one of the main ways Putin stole then 2016 election. he and his trolls tricked a lot of bernie supporters into voting for Stein.  Which turned out to be the same as voting for trump.",552,
297,Lazy_Gringo3,"You are fing insane.  No rights over their bodies?  Who are you, the inmvasion of the body snatcher alien?   Go away.   and dont vote if you hate democracy and civilian rights.",176,
298,nogooduse,tell that to rapists and pedos.,31,
299,ChemicalWay9591,"Wow!
You are so wrong it's ridiculous. 
The democratic party was founded by slave owning southerners  and they fought EVERY SINGLE LAW that would give black people equality for a century until lbj when they decided to instead use programs like welfare to destroy the community while brainwashing them to think they are being supported .

The idea of systemic racism is completely ridiculous since every law about race is to help minorities.
You talk about nazism?
The far left ideology is Clearly socialism which is as nazi as it gets.

Women's rights to choose is a buzz term.
So a woman carries a baby for 9 months.
Where are the child's rights to live for 65 years?
What about the father's rights?
Don't give me that It's not a baby bull.
98% of abortions are simply because the child is unwanted.  
So u kill it?
Dems ares good with words, bad with truth",858,
300,rfill01,"I guess most of the Americans don’t agree with you, imbecile",60,
301,,source? now i dont nessacarly like trump but i dont think hes racist,68,
302,Extension_Toe1164,"Can't think for yourself can you? Trump 2024. Go dye your hair purple and hug your boyfriend when he brings patriotism, common sense, prosperity and safety back to this country. Watch the Republicans even legalize weed the dems promised on so much(just one of many false promises). Dems should be in the same category as dinosaurs. Extinct..",341,
303,nogooduse," 

* **1973:** The US Department of Justice — under the Nixon administration, out of all administrations — sued the Trump Management Corporation for violating the Fair Housing Act. Federal officials found evidence that Trump had refused to rent to Black tenants and lied to Black applicants about whether apartments were available, among other accusations. Trump said the federal government was trying to get him to rent to welfare recipients. In the aftermath, he signed an agreement in 1975 agreeing not to discriminate to renters of color without admitting to previous discrimination.
* **1980s:** Kip Brown, a former employee at Trump’s Castle, accused another one of Trump’s businesses of discrimination. “When Donald and Ivana came to the casino, the bosses would order all the black people off the floor,” Brown said. “It was the eighties, I was a teenager, but I remember it: They put us all in the back.”
* **1989:** In a controversial case that’s been characterized as a modern-day lynching, four Black teenagers and one Latino teenager — the “Central Park Five” — were accused of attacking and raping a jogger in New York City. Trump immediately took charge in the case, running an ad in local papers demanding, “BRING BACK THE DEATH PENALTY. BRING BACK OUR POLICE!” The teens’ convictions were later vacated after they spent seven to 13 years in prison, and the city paid $41 million in a settlement to the teens. But Trump in October 2016 said he still believes they’re guilty, despite the DNA evidence to the contrary.
* **1991:** A book by John O’Donnell, former president of Trump Plaza Hotel and Casino in Atlantic City, quoted Trump’s criticism of a Black accountant: “Black guys counting my money! I hate it. The only kind of people I want counting my money are short guys that wear yarmulkes every day. … I think that the guy is lazy. And it’s probably not his fault, because laziness is a trait in blacks. It really is, I believe that. It’s not anything they can control.” Trump later said in a 1997 Playboy interview that “the stuff O’Donnell wrote about me is probably true.”
* **1992:** The Trump Plaza Hotel and Casino had to pay a $200,000 fine because it transferred Black and women dealers off tables to accommodate a big-time gambler’s prejudices.
* **1993:** In congressional testimony, Trump said that some Native American reservations operating casinos shouldn’t be allowed because “they don’t look like Indians to me.”
* **2000:** In opposition to a casino proposed by the St. Regis Mohawk tribe, which he saw as a financial threat to his casinos in Atlantic City, Trump secretly ran a series of ads suggesting the tribe had a “record of criminal activity \[that\] is well documented.”
* **2004:** In season two of *The Apprentice*, Trump fired Kevin Allen, a Black contestant, for being overeducated. “You’re an unbelievably talented guy in terms of education, and you haven’t done anything,” Trump said on the show. “At some point you have to say, ‘That’s enough.’”
* **2005:** Trump publicly pitched what was essentially *The Apprentice: White People vs. Black People*. He said he “wasn’t particularly happy” with the most recent season of his show, so he was considering “an idea that is fairly controversial — creating a team of successful African Americans versus a team of successful whites. Whether people like that idea or not, it is somewhat reflective of our very vicious world.”
* **2010:** In 2010, there was a huge national controversy over the “Ground Zero Mosque” — a proposal to build a Muslim community center in Lower Manhattan, near the site of the 9/11 attacks. Trump opposed the project, calling it “insensitive,” and offered to buy out one of the investors in the project. On *The Late Show With David Letterman*, Trump argued, referring to Muslims, “Well, somebody’s blowing us up. Somebody’s blowing up buildings, and somebody’s doing lots of bad stuff.”
* **2011:** Trump played a big role in pushing false rumors that Obama — the country’s first Black president — was not born in the US. He claimed to send investigators to Hawaii to look into Obama’s birth certificate. Obama later released his birth certificate, calling Trump a “carnival barker.” The research has found a strong correlation between birtherism, as the conspiracy theory is called, and racism. But Trump has reportedly continued pushing this conspiracy theory in private.
* **2011:** While Trump suggested that Obama wasn’t born in the US, he also argued that maybe Obama wasn’t a good enough student to have gotten into Columbia or Harvard Law School, and demanded Obama release his university transcripts. Trump claimed, “I heard he was a terrible student. Terrible. How does a bad student go to Columbia and then to Harvard?”",4756,
304,nogooduse,"I'm a  straight, normal white male, a real Christian and GOP voter (that is, when the GOP gives me a non-racist, non-fascist to vote for).  Don't pretend to speak for me or others like me.  We are appalled by hypocrisy, white supremacy and hate.  Not to mention frankly insane conspiracy theories about stolen elections, shadow governments, and all the other angry fantasies.  (Like calling Biden a socialist, when he's to the right of Eisenhower.)  Trump fans speak of 'Christian morality': an oxymoron in today's US given the 'Christian' support of racism, various church sex scandals, etc.  If Christ appeared among you today, you would reject Him and try to have him arrested.  Freedom: police killings of unarmed people, attacks on peaceful demonstrators, book banning, laws against giving voters in line a glass of water, taking people from voting rolls for no reason, harassing pregnant women and their doctors...the list is endless. If you people really believed in the rule of law, you wouldn't support insurrectionists or killer cops who make themselves into judge, jury and executioner.  Thank God enough people cared about decency and truth to vote against Trump.  It's just too bad that the GOP failed to come up with a decent candidate. Trump didn't deliver on any of his promises; he's a notorious liar, and only a fool would believe that a second term would be any better than the first. All sizzle, no steak.

The GOP failed to put forward a decent, rational, intelligent, non-criminal candidate.  Instead, they offered a corrupt, ignorant, draft-dodging incompetent serial liar; a failed businessman (in spite of daddy's money) and ex-game show host who main talent was whipping up hatred.  Biden isn't much, but he's way better than the person he replaced.",1775,
305,Lumpy_Ad3349,I think halfway MAGA and moderate Republicans is someone like Haley,67,
306,SunnyNowAndThen,He showed his true interest in helping the people when he ran off to Cancun while Texans froze.,95,
307,ReasonableGap7912,I'd vote for Cruz.,18,
308,RusevReigns,"My scale from 1 to Trump

1 - Romney

2 - Haley

3 - Cruz

4 - DeSantis

5 - Trump

Haley is friendlier to anti establishment side than Romney/Kinzinger/Cheney/etc. or someone like Bush, as seen by speaking at CPAC in 2020 while the real establishment guys were not. But she still leans establishment.",301,
309,,"DeSantis is way more radical than Trump.  Honestly if I could fix that list

1 - Asa Hutchinson

2- Chris Christie

3- Nikki Haley

4- Donald Trump

5- Ron DeSantis",164,
310,SunnyNowAndThen,Hutchinson would bring back slavery.,36,
311,,"That’s kind of a feeling, his record could’ve been worse, I mean he veto’d anti trans legislation and took a lot of push back for it, but stood by it.",150,
312,Scope_Dog,"please god no. Celebrities need to stay out of politics. Unless, they prove an astounding knowledge of facts and issues.",120,
313,ReasonableGap7912,I think you are probably right. But he's a pretty moderate guy,62,
314,Uva_Be,"There's an interesting 2024 candidate.  

&#x200B;

=D Alright, alright, alright.",81,
315,Consistent_Drop1006,If Gary Johnson can’t…,22,
316,kilmorekermiy,McConaughey v Michelle Obama?,29,
317,Immediate-Assist-598,"NO!   Hillary is as Trump told Stormy Daniels ""the most brilliant person on earth"" and we all respect her, but even though Putin deviously sabotaged her campaign in 2016, just the fact she could let herself lose after starting with a 20% lead means she is a 2nd rate candidate with first class credentials.   

I have predicted every Dem nomination since Jimmy Carter.   It is too early to know who is running in 2024, but assuming Biden has never intended to run again, let's take him off the list.   The three strongest candidates then become Gavin Newsom, Kamala Harris (both from California) and then a third, and this third I am personally lobbying  to run, see my Matthew McConaughey for President subreddit.   Matthew might be motivated now to become the democratic reagan, and if so, he would win Texas, so end of story, but he could indeed win by 45 states, a complete blowout. Desantis wouldn't stand a chance against him.  If Matthew doesn't run, or some other very charismatic candidate doesnt emerge, I am for Gavin Newsom.  He will have to tack to the center, but he has it all otherwise.",1102,
318,,"Yeah Mathew McConaughey is not going to be president and would be a terrible choice. If he likes politics he should run for a different office. Gavin Newsom is decisive and will never win. Everyone hates Kamala(I don't but she is incredibly unlikable). We need a strong seasoned hand like Hillary. Hillary is the greatest, get on the Hilltrain.",344,
319,Immediate-Assist-598,"Spoken like a true RNC spin doctor.  The GOP is terrified of all three of them. especially Matthew.   So please spare us the false assumptions and kneejerk hatred and stupid insults aimed at anyone who isn't a Maga neo fascist republican.   The country cannot afford Trump or Desantis as that would be the end of democracy and what makes America truly great. Also, Putin is behind botrh of them and in case you hadn't heard, Putin is our enemy and we are basically at war with him now, a very just war on our part I might add, and a mandatory one.   The question is what comes next?  Gavin Newsom might be great but if it is close race and Trump-Desantis uses the election fraud tricks they have already set into place, well not very good for our country, right?  and Kamala Harris might rise to the occasion and catch fire. Biden might even run again in much strronger shape than he is now, but I a, looking for another answer to save the USA.

Matthew McConaughey almost ran for Texas governor.  That proves the baseline, that he is considering running for very high office.  If Beto hadn't been there, much better prepared, Matthew might have gone for it. He would have won by a landslide too. Or maybe Matthew just didn't quite think it was worth giving up his wonderful career, family and charity life.   But president if the country really needs him?  

Matthew returned to his super fun family, show biz and charity life, but then Uvalde happened. His hometown. That changed his life.  That struck him very deeply.  He hired a political lobbying firm and next thing he was at the White House podium,  meeting with Biden, top senators of both parties and making his presence known. You can also see the experience deeply moved him and no doubt he knows that if he wanted the presidency and devoted himself, he could win it.  

Matthew has been underestimated all his life.   There is something about him that transcends all the usual partisan BS. He is a combination of liberal and conservative.  No one owns him.  And anyone who says an actor can't be a great president remember Zelensky was nothing but an actor before he became the greatest president in the world.  Not to mention Reagan, Al Franken, Arnold and others who have excelled.  So people complain about career politicians and gridlock, well Matthew is the answer.  Now he just has to decide to go for it.    if you agree, join me on my MM for president subreddit and let's do our part to encourage him.",2472,
320,Snee_REinvestments,"Please, Hilary is the establishment. She supports her base and her rich donors. No thank you ever. I’ll take Kamala over Hilary any day. 

I want a real person with real people issues for VP. All these generational rich people have no clue what it’s like in the America I live in.",280,
321,Uva_Be,"Kamala is unlikable for the same reason Hillary is very difficult to like. Well, one has a trial history that too tough for her own good, and the other didn't even bother to travel to all the states that mattered in the 2016 race.",230,
322,Immediate-Assist-598,Also go to my subreddit Matthew McConaughey for prez,52,
323,floridapoliticalnews,"Main problem is all his opponents would have to say is ""What happened the last time we put someone with no gov't experience in the oval office?""",144,
