tweet_id,user_handle,Comment,Comment Length,sentiment
186,MikelDP,"America is also the 16th in countries with the cleanest air using the EPA's list of what it considers real ""air pollutants"".

Other countries pump real air pollution in to the environment. America spends tons of money converting pollution into CO2 for the environment because thats what plants crave.

The US is between Portugal and the Netherlands on real air pollutants.

EPI Yale",382,
187,Uva_Be,"Very true. Presidents aren't dictators. 

That's why I'm starting this conversation before the 2022 primary. 

No matter who is in the White House. If they want to get anything done, it is up to the people to get rid of the do-nothing-Democrats who are acting as obstructionists partisan Republicans. 

We need to elect member of congress who actually listen to us, not get bought off with corporations dirty money. 

Also, again correct. Climate change is a world problem. We need to lead by example and work with the entire world to fix it, AND it's probably going to take 1,000 years IF we mitigate the damage and clean up oceans and care for drying up underwater aquifers, etc....

I totally agree. 

BUT, for the first time young voters 35 and younger are the majority. 

Young people have the numbers to replace our current Congress and Administration.",858,
188,Trick-Needleworker41,Liz Cheney cannot even win her own state for re-election and you think she will be a good person for president?  Lol,116,
189,Uva_Be,"Okay, good to know about AOC, \*blerg\* I'm not going give up on her until she actually loses. She is human, I get it. But, I still like her a lot .  

I should read the specifics about that Ukraine aid. I know people in Ukraine and from Ukraine and Russia actually, and I am having a very difficult time following the news, I just weep and am totally useless when it comes to fear or WW3, I'm a total anti-war, hate-war wimp. 

I think McConaughey is ""interesting"". I like him. I'd totally vote for him myself.",511,
190,Uva_Be,"Ah reality. That's why it is Dream candidates, not actually what we have got candidates. 

:)",93,
191,Uva_Be,"That would be excellent for TX to have Beto as gov, and by extension and because of the importance of the TX to the rest of the US States, I agree, Beto stay in TX.... for now :)",178,
192,Uva_Be,"Agree about the Dems. I can't believe the shit they pulled in NY, how many votes was it? over 100k people found they were suddenly de-registered?! 

Also, how did the lame-stream-media not get fined for putting up images of the wrong man instead of Andrew Yang?! Or the Dems cutting his mic off when he tried to speak. 

So the Rock huh? Interesting. I don't know much about him. Fun reading for me. He seems like a very nice person in interviews. As far as I know, I'd totally vote for the Rock. Gotta be honest still makes me laugh tho. It's the wrestler president combo, sorry. 

Thanks for the dream candidate suggestion, exactly why I posted this.",652,
193,Uva_Be,"He is, I agree. 

Where are our young people in the Senate! 

Well, they have to wait until they turn 30.",105,
194,Uva_Be,Interesting.,12,
195,Uva_Be,"Wow, that is sad. Not much of a choice. 

Some good news? Younger people currently out number boomers.",102,
196,Uva_Be,"That's great, Cory Booker is totally on a short list of politicians with heart. 

I'm reading now about Gretchen Whitmer, thank you :)",134,
197,Uva_Be,So only old white men for you huh?,34,
198,Uva_Be,Really? 2 billion people from where? Interesting.,49,
199,Uva_Be,"Do tell. How would tax collecting work with no personal federal income tax, and no IRS. 

Seriously, details, data and sources are appreciated.",143,
200,Consistent_Drop1006,Work visas get me hot and bothered 🫠,36,
201,Uva_Be,"Nope. I don't understand why people dislike her so. 

I think she has a lot to offer. And I'm grateful that she is serving in congress. 

P.s. Do you have actual logical reasons why she is not a good politician or are you judging her by her dancing and remarks taken out of context when dealing with complex people in the US?",325,
202,Uva_Be,"Hold them responsible? He he he he we 330 million against how many billion China and India combined? =D sorry, very funny.

They did stop taking our plastic trash. 

China is working very hard to get water to irrigate crops and for the cities in drier areas of their country. And they are producing solar panels like crazy. 

I totally agree on the right-to-repair computers, and use your phone till it actually breaks, do your part to stop e-waste. It's a problem both coming and going. I.e. getting the materials to make the computers and no way to dispose of them.

I can't deal with the human rights issues. I'm mad enough about child poverty and other crimes against the working poor and the last shreds of the middle class in the US.",739,
203,Hilldog2020,I can enjoy things and still fix the world sweetie,50,
204,Uva_Be,"Air pollution is your focus huh?

 I think we have a lot of work to do to get clean water to all our people.  Top Causes of Water Pollution · 1) Rapid Urban Development · 2) Improper Sewage Disposal · 3) Fertilizer Run-Off · 4) Oil Spills · 6) Chemical Waste.

I've been angry at the garbage we produce since I was a teenager. The US generates the most waste per person. The United States makes up around 5% of the world's population but produces 12% of the solid waste. 

All this said, Earth is a small planet, and we all have to work together. The climate, air, water and solid waste when it gets into the worlds oceans, pollution doesn't understand boarders or ranking systems. 

Lately, I've been focused on reducing waste before it is produced. We need to hold the producers of pollution responsible, not just carbon tax, but reducing unwanted products from production.",875,
205,Lazy_Gringo3,"Cheney or Romney could win the GOP nomination if the GOP decides to purge all Putin and Nazi influence from its ranks.   Both Trump and Desatanis are Putin puppets and as you saw in the Russian funded Turning Poinjt convention this past weekend it is all about hate hate hate.  Hate everyone but straight white male evangelicals and Russian useful idiots basically.  Nazis marched for Desatanis in tampa and he was fine with that. No comment.  But do I expect cheney or Romney to win the GOP nomination? Of course not. Not unless Putin and Murdoch say. and they will not,",571,
206,Visible_Music8940,"It is an unfortunate thing indeed. That's why I led with my boy, the one, the only, Chuck Norris.

Although given his age and political background, he would be an awful choice.",176,
207,OverallGamer696,"In my opinion, no one over the age of 80 should run for president.

Thats why I would rather have Buttigieg run in 2024 rather than Biden",137,
208,3bas3,"That is good news. And the chances for the Democratic Party to move left will increase. But understand this, and make sure everyone you know realizes. It’s a binary election. The two candidates **are not** equal. One is an autocrat who whether he loses or not is going to claim he won. Trump is a clear and present danger to this countries social landscape. Look at what he did with his first four. Now take all the chains off and guards as Trump surrounds himself with Acolytes who kiss his ass and do his bidding. 

To undersell that this isn’t the pivot point in our republic is a major disservice. We will either have an aging out liberal centrist or an authoritarian. If the authoritarian wins wanna see what they can come up with next? It wont be just women’s reproductive rights. The lack of enthusiasm for Biden should scare everyone.",842,
209,,"I don't f***ing care about race age or gender. If a Black lesbian disabled 30 year old woman can double the GDP growth or make America the happiest country in the world, I will vote for her.
It's actually progressives who are racists and sexists! They prefer a weak and non-functional congress with queer and black senators and reps to a bunch of straight white men getting the job done!",387,
210,,"Holy shit, straw man much? This shit right here is why i hate the left. You all make associating with you unbearable. It’s actually embarrassing sharing political views with you.",178,
211,rlivenmore,From the less developed countries.,34,
212,rlivenmore,"I didn’t say no IRS. Some entity has to collect taxes. Why should we fill out forms when the IRS will let us know if we made a mistake and adjust the amount owed or due accordingly. They have all the numbers, already. Filling is a form of slavery.",247,
213,TargetNo9243, Only think she can do hahaha is onlyfan,40,
214,Uva_Be,Tell US more.,13,
215,MikelDP,I agree with all of this.... And clean air.,43,
216,Uva_Be,"Romney. At least he had some good ideas as related to healthcare. But, how will that work as the leader of the GOP? I mean would it go anywhere with today's GOBs?",162,
217,Uva_Be,"Yeah, :) that is a funny dream. I think that's a meme.

Lately, when I get a clip of Jon Stewart, (I very much dislike that his show, The Problem is on Apple, there are too many streaming services and divided camps created by the OS you own or don't own). Anyway, I do like how he can debate with the best of them. 

But, other than that, I'm just watching and waiting with the rest of the US. 

I agree with what you said about the administrative team, or most of them, that Biden brings to the White House. I'm waiting for DeJoy to be removed from Postmaster General. And a few other things to happen. My main complaint is inaction on removing people who have hurt the American people, like (as you mention) the judges, even the ruling against the EPA alone, the potential damage to everything living is ... I don't know how to measure it. Preventive damage is not easy math. Especially when one the metrics is corporate greed. Sorry, now I'm going on a tangent about reality.",978,
218,Uva_Be,"Beto O'Rourke is the POTUS in my Bernie as Vice President dream team by the way,

Bernie is in that chair dealing the Veto votes for the Senate as VP. 

Beto, he's very young IMO, he just needs to go national, quit messing with TX.",231,
219,Uva_Be,"Oh, that's a relief, US population is not that many people. 

The ones on the shore that are under sea level? Or crop failures. And wildfires in areas that never burnt in recorded weather history? Scare tactics? 

The middle class has increased in some countries over the past 10-15 years. Tech jobs going remote, plus increase of their own growth not related to us directly. It's global economic leveling. 

I never know who these leftist are? I think they are a conspiracy myth, maybe?",487,
220,Uva_Be,"It sort a feel that way when doing yearly taxes. 

Some folks on Twitter were talking about Social Security Caps and Solvency. 

What are your thoughts on that I wonder?

https://www.ssa.gov/oact/cola/cbb.html#:\~:text=We%20call%20this%20annual%20limit,2023%2C%20this%20base%20is%20%24160%2C200",294,
221,Uva_Be,thanks,6,
222,Visible_Music8940,"Tangents are what I live for my friend.

I agree with you about the hesitancy Biden has shown about removing people. It frustrates me, though I do understand it. He does not want to create the impression that a president can just remove everyone the previous administration appointed.

If that sort of thing stops with Trump,  it is an anomaly.

If it is continued it becomes a new and dangerous normal.",403,
223,Uva_Be,"Yeah, I do think it is a good thing that the former VP who has first hand experience about how The Administration is intended to work, for 8 years. Biden, now following after Trump. Who couldn't even fully staff his Administration. The turnover and vacancies were insane, 2017-2020.

The time lag thing, actions having repercussions, that show economically, and cause measurable harm later, after one team is replaced, both good and bad. It's very confusing the way the news blames/gives credit to whomever is in charge for many events caused by actions made in the past. (no, that's not it) Umm...?

I'm trying and failing to agree. Some appointees are too harmful to ignore. 

Trump gave himself credit for things Obama did, even while he was tearing down those past efforts. 

And Biden is getting blamed for things and people Trump left behind. Repair needs to be done. IMO they should just tell the people why they are doing it, and do it already.",952,
224,Visible_Music8940,"News is good at a lot of things, contextualizing complex information and framing it in a broader historical framework is not one of them. 

According to the news, whenever something happens, it is the fault of the president, regardless of whether or not they had anything to do with it. 

I would love if almost everyone Trump appointed or promoted was collecting unemployment benefits tomorrow, but Biden is an institutionist, it would go against his nature.  My hope is that in 2028 the Democrages field someone a bit more willing to alter the fundamental issues with our governmental system.",594,
225,Uva_Be,"I like the word Democrages. 

2028 huh? Not as soon as 2024?",60,
226,Visible_Music8940,"Thank you for forgiving the spelling error. Democrages? How embarrassing.  

But yeah, 2028.

I don't think 2024 will feature a progressive candidate,  and any situation that would include one would necessitate  the implosion of the current administration. 

Even if they were to win, I don't think it would be worth it. 

Also, my pride demanded the overinclusion of pretentious verbiage I suppose, I hope you can forgive me a second time.",440,
227,Uva_Be,"No, I really do like it. :) I'm very literal. 

Thank you for your sincerity. 

No worries. g is bellow t on the keyboard.",122,
228,Uva_Be,"First let me alleviate the fears of the Vote Blue No Matter Who folks. 

I live on the West coast. If someone doesn't have a chance as the time zones move across the nation and the exit polls start to roll in I'm not going to vote for a lost cause because of some ideology that's being disappointed, again. I'm not an extremist. I'm a moderate. 

I have voted for the Democratic candidate in the lead and I'm 90% sure I'll be doing so again because we don't have rank choice voting in the US, because of the imbalance between how much a vote is worth in the rural middle of the US versus big city votes and because our electoral college system is working against the American people, failing to do what it was designed to do, i.e. prevent greedy people from using the White House for their own personal profit. 

But, that's also why I wanted to start this conversation. The idea of voting for Hillary or Biden makes me feel physically ill and sad at the same time. Biden is a good one, but he should be retired.  And the history of hate and lies the lame-stream-media has built up against Hillary over the decades is too much for any regular TV news or Facebook user to easily overcome. I really had to work to research enough about her to decided I liked her before I voted for her in the 2016 election. No, I didn't vote for her in the primaries, ever. 

Okay, enough of me talking. I really, really want to hear from some young people, younger than this middle aged Gen-Xer.  

☮",1483,
229,T0iletTrades,My vote would be for Admiral William McRaven. It blows my mind that we’re stuck voting between two senior citizens..,116,
230,nogooduse,there is no 'independent leaning majority'.  43% of voters identify as independents.  and most of them lean D or R.,115,
231,RusevReigns,"Not sure there are real independent voters anymore. The US is in a mirror reality where you either think the far left are insane authoritarians or you think the far right are. It just depends which one you believe.

The person in the middle would be someone like Haley who is somewhat anti Trump Republican but hasn't gone full Liz Cheney.",339,
232,Crazy-Sir512,Anyone who voted for Biden or Hilary proves they probably shouldn’t be allowed to vote : all the stuff yall suggest against Trump is double true about them . I understand if you thought Obama was cool,200,
233,SofaKingJEDI,"www.shearree2024.com

Younger but I'm not a millennial and I know what gender I am since I looked down and saw my penis at the  young age of whatever it was. for me pronouns are about grammar they are not a lifestyle but that's just my personal opinion",252,
234,Uva_Be,"Thank you, I wouldn't have read about Admiral W. McRaven without your vote, here.

It just confounds me, there are many, many Americans who sure seem like they would be better options then those two senior citizens. 

And I'm just... I don't know why there is no popular conversation about finding someone. 

And... when did I first post this? 

Just saying they have to be on the ballot by March 2024 whomever they are, and it's not going anywhere so far this year as of January 2024.",485,
235,Uva_Be,"On a very serious level I agree, there are no real independent voters -- because there are no independent candidates to vote for. 

The closest we got to being about to vote for an independent socialist was Bernie Sanders. 

I think Andrew Yang wants to represent the majority with the Forward Party, but the people are too afraid they will just spilt the vote and Republican's will win. 

Still it is a real trend since 2004 the Independent leaning is the majority in the US, have you read the Gallop polls? 

I agree, the Do-Nothing-Democrats and the Obstructionist-Republicans it really is no choice at all. 

We need 100 more Katie Porters IMO to actually get anything done. And she's not an Independent, she a Democrat Rep in a historically Republican area of CA.

Sorry, I don't have any answers. I just look at the demographics of young people and I want more of them in Congress and way, way more young people to vote.

People under 30 of voting age outnumber the boomers now, as you probably already know. I'm repeating myself.",1036,
236,SunnyNowAndThen,"Haley is NOT qualified for the presidency.  No one is who hasn't served in congress at least two terms.  And her goal is a war with China.  She is always talking about that - at least on instagram.  If you are unable to see the outstanding job Biden has done, then you need to look again.  He accomplished stunning things with a mostly hostile congress.  No one else has done that since FDR.  Choosing an inexperienced third part candidate means trump will win.  It is that simple.",481,
237,Uva_Be,"Just wondering.

Would you say you watch more TV or read more on the internet?",78,
238,nogooduse,do try to stay on topic.,24,
239,SunnyNowAndThen,"There is nothing wrong with not choosing to affiliate with a party.  And I do agree that young people should have a lit more representation in congress than they currently do, but congress is a job like any other and experience is too valuable.  If they studied political science in college or economics that is a great start.  Go out an look at a bill online and you will see what I am talking about - they are not a read for people who don't read well.  Please don't look at gen x or boomers like they are old and useless and not in touch.  A lot of us ARE in touch and a lot of politicians of those ages are too.  I hope you and all your friends will vote!!!",661,
240,SofaKingJEDI,https://youtu.be/3aZ0SoNOrzw,28,
241,Bertovibe,"Voting is an inherently biased action. You vote for what matters to you and that is founded in your upbringing/environment/personal life experience. Sorry kid, but you have to figure out what’s important to you and your community. You vote based on what you feel is going positively change any negatives you perceive and what positives you want to cultivate. I would encourage you to travel to other communities and see how they live, how laws affect their lives and how other people are affected by the government around them.",527,
242,SunnyNowAndThen,"Read newspapers your local paper, NY Times, Houston Chronicle, Washington Post, Miami Herald, LA Times, Chicago Tribune, watch news on TV - but not news networks - watch ABC, CBS, NBC.  With newspapers they can be sued for publishing lies and that is why they are the most trustworthy most of the time.  SAme goes for broadcast news on ABC, CBS and NBC. If you see a story in all of them you can be safe believing it true.  For Biden his deeds qualify him as far as I am concerned which you can see on social media in his posts.  The prez can't claim to do a thing and lie without the world coming down on him/her.  For trump the Jan 6 committee report is online for all to read with under oath testimony and it is eye opening.  

Above all avoid OTHER PEOPLE'S opinions on issues and candidates.  Joe Rogan  and George Conway are entertaining commentators but their opinion is no more valuable than another persons or as trustworthy.  The best way to judge is by what the candidate has accomplished, failed to accomplish, promised or will promise to do.  If you have a friend who is for Biden ask them to tell you why.  If they are for Trump, ask the same.  If they can't give you truthful reasons that don't involve prejudices or lies then decided for yourself if you value that opinion.

Look at the Dems and GOP two candidates before you consider a third party.  Why?  Because a third party, unless they can certainly win, could skew the election for the candidate you DON'T want.  Third parties have swept thru before in American history but it is rare.  I don't see it happening here this election, but the next one??  Who knows!!",1636,
243,Crazy-Sir512,Well tell me your assumption first . Why do you ask,51,
244,SofaKingJEDI,"That was a year ago, as things are now I avoid this topic and try to pretend all is not lost. Still have a penis tho.",117,
245,Uva_Be,"Me too. Everybody vote please. 

&#x200B;

P.s. I'm Gen-X",57,
246,Honest_Let_7800,I want to share this. In many places as I can.,46,
247,Uva_Be,"Oh hi there. I have been doing a lot of research since 2016, trying to understand how the US got to were we are now, so divided. And I have a theory that the mainstream TV news, mostly FOX but not limited to them has been using CIA level brainwashing techniques of repetitive talking points. For decades, since the 60s. And it's not limited to just politics. It's also crime, racism, anti-women, etc... The goal is corporate profit, just in case you wondered. 

And the other part of it, the Red/Blue divide is life experience and family history. Some people have TV playing in their homes, just running, to keep them company. Other people like my Mom didn't allow a TV in the house at all. 

Sorry, to ramble, but, I'm a 100% say what I mean kind of fool. I just ask. And I don't blame anyone. It's the way their life happened. We don't get to pick our parents.",862,
248,Bertovibe,If you are not feeling confident that you are doing it right because your are taking many factors into consideration. You should never just assume you have all the answers and not be willing to compromise. Compromise is what makes government/community work best. Do not just pick a side and stick to it. Be flexible and vote with your heart and conscious.,355,
249,SunnyNowAndThen,Please do so!!  And thank you.,30,
250,Crazy-Sir512,Okay I think I’m outside the study to be honest I’m very curious and I always find out what the opposite thinks my cognitive bias isn’t bad and I’m well read or atleast I got the point of enough books and schools of thought and history . I am a Christian but I also am moderate enough I’m not forcing you to have that baby but please don’t abort . I don’t vote .,362,
251,Bertovibe,I didn’t mean you are assuming you have all the answers. I was just generalizing. I think you’re on the right track.,116,
252,Lazy_Gringo3,Pretty much nonsense. You have no idea who black voters would prefer n 2024. They voted for Biden in 2020 though young blacks unwisely protested.,145,
253,Immediate-Assist-598,Matthew McConaughly wins. Would win 40 to 45 states with 70% of the vote and 97% of minorities.,95,
254,Uva_Be,I wonder what a Latino voters list like this would look like.,61,
255,UnlikelyFunction652,"A carefully put together list of black folks, and the black vote went for the white man….",89,
256,Lazy_Gringo3,"Matthew McConaughey runs a charity for underprivileged minority kids and is buds with Snoop Dog.   No one no matter what race cannot fall in love with Matthew.  The only two viable candidates on that list are Harris and Newsom, but if Matthew runs, they are beaten.",265,
257,ReasonableGap7912,Any serious candidates?,23,
258,Neowwwwww,No RFK ?,8,
259,Hilldog2020,Pete Buttigieg  looooooooooooooooooooooooooooooooooooooooooooooooooooooooooooooool,82,
260,RusevReigns,"It was predictable that Biden would be more popular with black voters than Bernie, Buttigieg, Klobuchar and Warren based on being Obama's vice president, that's before considering that the same tiebreaker I gave it Newsom and Brown here over the other white candidates (straight christian male) also favored him.

Going into the 2020 primary when Harris was a frontrunner you could not have used black voters to determine that Biden would beat her. However her campaign collapsed for other reasons including likely being way less popular with white voters than Biden.",567,
261,Lumpy_Ad3349,Same,4,
262,ReasonableGap7912,I was going to just troll but hell your right even i would vote for Matt,72,
263,ReasonableGap7912,🤣🤣🤣🤣🤣🤣🤣🤣🤣,9,
264,ReasonableGap7912,honestly the democrats have no chance at all and it's Joe bidens fault.,71,
