tweet_id,user_handle,Comment,Comment Length,sentiment
131,Kacenty,"not you talking about democracy while telling me to stay home. the hypocrisy. DEMOCRACY yet the DNC are censoring people??? They don’t care about democracy - they care about control. If they cared about democracy they would have pushed Marianne Williamson. A DEMOCRAT WOMAN.  but It’s not corrupt clinton i guess so “IM WITH HER” doesn’t work for them anymore. You’re a victim of tribalism in politics so i can’t take you seriously. biden is losing. he has been losing. Drink the kool aid all you want, biden is finished. The DNC fearmonger you and you fall for it. Trump is not going to destroy America in 4 years. STOP VOTING OUT OF FEAR. YOU are the one throwing your vote away because biden is a lost cause. Kennedy is the only one actually getting people from all sides of the spectrum to support him. can’t say the same for biden! Kennedy24.com/spoiler whoisbobbykennedy.com or just stay ignorant and cry when trump wins. 💜",929,
132,rfill01,Poor brainwashed individual. You call America under biden democracy? Thanks God Trump won. Now we will have democracy instead of socialism.,139,
133,jmd709,It’s not so much about voting Red or Blue in the general. I see it as voting for whichever direction I’d prefer for the US to move. Biden is a moderate instead of a progressive but the alternative option is for the country to move more towards the right. It appears that’s also how you view the general election with primary elections as the opportunity to show you’d like to have a more progressive candidate. I’ve noticed a handful of things that appear to be attempts to convince independents or progressives to vote third party. Those give off a vibe of attempting to have a Ross Perot of 2024 but for left-leaning voters instead of Republican voters.,655,
134,Top-Ambassador-4981,"You’re delusional, sad to say. The women in the US   are going to create a Blue Tsunami. You / please -stay home",112,
135,Uva_Be,"The terms are so confusing. Biden is a pragmatist, but I don't find him walking that fine line that is moderate? I don't know how to express it. Radical center, best US example was JFK. 

Pragmatic conservative is Reagan. Terms. Are they useful? How do we the people make ourselves heard?

Quote: searched for Definition  
Political pragmatism definition  
“Political pragmatism” refers to a kind of willingness to do whatever works to reach the desired goal, but it does not, it cannot, say what that goal will be. For example, right now, confronting our looming economic depression is a non-controversial and urgent goal; no one denies its importance.",655,
136,Kacenty,and you are at the bottom of Graham’s Hierarchy of Disagreement. Operating out of fear. You’re a coward with no backbone. I vote with my heart. you can vote based on CNN. Sit and wait for the day that maybe this corrupt duopoly will do something for you. The independent thinking women & men in the US will do the hard work and bring a new american revolution. Cheers 🍻,369,
137,rfill01,Crazy women will be protesting. They can kiss Trump and our you know what. You can join them.,93,
138,jmd709,"Moderate is relative based on the position someone is looking at it. To someone with conservative or far right views, he doesn’t appear moderate, he is a leftist. To those that hold more progressive or far left views, he is too moderate/not progressive enough. He is close enough to center to either appeal to a wide range of people or the opposite by only appealing to a small group by not really appealing to progressives or conservatives. The center is where the majority are though instead of far left or far right. 

Anyone that considers themselves as moderate or left leaning can’t realistically vote for someone far-right like most of the GOP nominees presented themselves as. Some that consider themselves moderate and right leaning will have a hard time choosing far right over a choice that is closer to center even if it’s somewhat left of center. I was hoping for a true GOP nominee this year instead of candidates the either lean hard right or based the entire campaign on trying to pull back the curtain for voters to see who #45 is simply because that particular candidate finally saw what was behind the curtain after being a supporter for however long.  

If it’s based on policy, there is one very clear candidate to vote for in 2024 because of what he has accomplished since taking office in 2021 and even the things he attempted to accomplish that were either blocked by Congress or federal judges. 

He has proven that his priority is others instead of himself. The front runner of the GOP continues to show he is his #1 priority and he will look out for himself without any regard for the damages that has or will cause for anyone else. It’s hard to believe he is prioritizing America considering he knew he was facing criminal indictments that hadn’t been announced yet but chose to run instead of stepping aside to let other candidates have a chance at becoming the nominee without all the excess baggage. Someone that truly cared about America would not have done that.",1995,
139,SunnyNowAndThen,"Oh, and reagan is the one who stole first from the social security trust.  Not only did he slam down the middle class and poor and take pride in bratking unions, but he got laws passed for the first time that let the rich skip taxes and run wild.",246,
140,SunnyNowAndThen,JFK almost got us into nuclear war.  He was not smart enough or experienced enough to be president.  That was the first time a president was elected based on his looks and jokes.  It was not a good thing for this country.  He couldn't get civil rights passed and that was just the biggest of his failures.,305,
141,Top-Ambassador-4981,"I don’t watch any news shows at all. 
I guess we’ll just have to agree to disagree.

Best to you & yours.",105,
142,Uva_Be,"Perfect answer, .... needed that. Thank you :)",46,
143,Uva_Be,"Yeah, Reaganomics [https://en.wikipedia.org/wiki/Reaganomics](https://en.wikipedia.org/wiki/Reaganomics) =( Terrible long term impact we are still suffering from today. Gutted the middle class with debt.",203,
144,Uva_Be,"I think it was a weee bit more complicated than that. Sorry. I still rather like him for trying, idealists, center radical. He could have done a lot of good it ""they"" didn't kill him.",183,
145,jmd709,"I feel you on all of that for the most part as long as the “y’all” wasn’t directed at me and I should be reading it as “those/they”.  

I give trust until I have been given a reason not to. I don’t consider being a politician as an automatic reason not to give trust. Trump makes it impossible to say, “every politician lies” as if all politicians are on the same level with the quantity and types of lies. You didn’t say that but I included it as an example because of the thing about not trusting anyone and the part about they all stick together. Some stick together with a blind devotion (or at least act like it’s a blind devotion but it’s really about doing whatever benefits themselves the most), and sometimes it’s necessary in order to get something pushed through because it’s better than the alternative of getting nothing pushed through. 

I was getting angry and frustrated about politics for a while & I realized that for me the main source of that was FB. I joined Reddit and started using it as my go-to for feed scrolling that I would have been doing on FB. Reddit has the perk of being able to choose the type of topics you want on your feed. Sometimes I just need really like stuff like videos of animals and old people being silly or cute, most of the time I’m fine with having a wide range of topics on my feed. 

I also started using comedians, specifically night time show host monologues, as my go to sources to hear about current events instead of reading about current events on news sites. I’m perfectly fine with admitting I prefer bad news to be delivered with a punchline. Sometimes that can get to be too much depending on what’s going on so I take a break. I live in an area that is considered deep red. I can’t completely avoid politics sometimes. Hearing an elderly guy rant conspiracy theories as if those are actually facts at the local Dollar General while I’m just trying to checkout and leave makes it hard to ignore the reality that things aren’t going well in terms of ummmmm a decline to “WTF, some people are actually that F-ing dumb and gullible?!?!” I’ve learned to just repeat a mantra in my head, “some people are alive because breathing is involuntary-it doesn’t require thinking” or just “breathing is an involuntary action” over and over because Idt some people would still be alive if they actually had to think in order to breathe. 

Things aren’t great right now but it’s definitely better than it was 4-7 years ago and better than how bad things could potentially get if the oversized OompaLoompa gets back into office. I’m optimistic enough Americans understand it’s important to prevent that from happening that he’ll lose to Joe Biden again by an even bigger margin than he lost to Biden in 2020.",2753,
146,jmd709,"For the most part, yes. 

But there are plenty of women that are beyond fine with taking away women’s reproductive rights that they’ll do things like record a response to the State of the Union in a kitchen like they’re trying to send a message that women belong in the kitchen. Katie Britt along w several other women in Congress are more of a danger to women’s rights that most of the men on the other side of the aisle. It’s mind boggling. 

She is rumored to be someone Trump is considering as a running mate so it feels necessary to say

 “that’s why we need a woman**!!! 

**that legit supports women’s rights”",616,
147,jmd709,"Trump has been charged for Jan 6th but Due Process/Presumption of Innocence is supposed to be provided to all citizens under the 5th amendment. 

He has been charged but the case has not been tried yet. No matter what our own eyes and everyone else’s eyes saw on Jan 6th, he has not been declared guilty of inciting an insurrection by a court of law. 

Would it have been great for the liberal justices to rule in favor of Colorado keeping him off the ballot? 

The answer is yes & no. 

It would have seemed correct to a lot of people but the reality is that it would have been based on partisan politics, which is not the assignment of justifies on the Supreme Court. Some justices seem to be confused about their actual assignment but that doesn’t make it okay for other justices to base their rulings on personal partisan politics. Those justices need to remain the outliers of justices that go against their oaths by allowing outside influences to buy or coerce them to rule a certain way. That cannot become the norm for all the justices just because a few don’t take their oaths seriously. 

Had the appeal to SCOTUS been after a court found Trump guilty of inciting an insurrection and the appeal had been to determine if the ruling was correct/appropriate, that would have been a completely different case. 

Honest justices could not base the ruling on whether or not he incited an insurrection because that wasn’t what the appeal was about. 

Trae Crowder, The Liberal Redneck has a good synopsis and his own opinion about it on YouTube. 

Some people benefit by presenting it as if the ruling was actually about whether or not he incited an insurrection but those people are opportunistic jack holes that are attempting to misrepresent it for their own benefit. 
.",1776,
148,jmd709,"What I came up with as my own answer to my “WTF? How???” is this: 

The founding fathers didn’t predict that a significant number of voters would be so gullible, morally corrupt, lack common sense, or any combination of the 3 to have the foresight that it’d actually be necessary to make “eligible to vote” a requirement to run for any federal office.",351,
149,,[deleted],9,
150,MTVChallengeFan,It's hard to link politicians when they work together.,54,
151,,Jon Stewart GETS IT and Katie Porter is such a badass but for 2024 I’m voting for cornel west in the GE,103,
152,Uva_Be,"The short answer - I typed linking, I meant liking, yes it’s a typo.   
  
The long answer – Linking versus liking. I linked POTUS and VP teams for 2024. True, but I actually meant to type liking. I could blame autocorrect. But, I think it was me. I can't read/edit what I write. I've never been able to do this. I'm also terrible at homophones, (words that sound like other words) and will often choose a wrong word based on the word I like the sound of better, in this case lie king versus linking, or le inking. It’s a Freudian slip, also called parapraxis, is an error in speech, memory, or physical action that occurs due to the interference of an unconscious subdued wish or internal train of thought.  
  
I copy and paste web links all day when I’m on the internet and I’ve been playing too much Zelda ZTOK, therefore Link’s on my mind. And Le inking it’s still #inktober. The ink is also, again on my mind.   
  
Contrast that with li king, I've been VERY anti kings and lies lately. Not, because of any real Kings in the world that I'm totally ignoring. But, because of the concept of kings and ""king-making"" both in fiction and in the actual wealth gap, I’m mentality weary of the wealthy ruling over and destroying for profit ""everything"" a.k.a. the planet we all share air and water on.  
  
All this typing to say, yes, this IS an error, meant liking, typed linking, posted it via copy & paste of a link on 6 social media platforms and didn't even notice the error until the next morning with coffee. That was Sunday. I don't like to pay attention to social media on the weekends because my BFF works 5/10+ hour days remote and I'd rather pay attention to the world I'm in and ignore the world via screens as much as is physically possible on weekends and I already “wasted/spent” half a day on Saturday on the social media.",1846,
153,Uva_Be,"After the cringe that was the Republican debate. I've kept my ears pricked while cat napping. Listening for anyone who would actual get work done for the American people. And today, Nov 16th, 2023, my favorite candidate in the race is Marianne Williamson #Vote2024 

P.s. This makes 5 apps for my social media test. eX-Twitter, Threads, FaceBook, BlueSky (sort of) and here. Mastodon was a bust, else that would have been 5.",424,
154,Honest_Let_7800,"Gotta check out this dreamy candidate! An AI running for president! It is a joke for sure, but the Q&A blog is not only far out there, deeper, under the joke… it kinda makes sense. Better choice than anything running as far as I can tell. 

[https://trumbama24.org](https://trumbama24.org)",289,
155,Uva_Be,"Interesting. They work in the same building or administration, but... beyond that lately, it's not been so good. Shutting down the government or threatening to, refusing to retire when they are ill, etc....",206,
156,Uva_Be,"Wow, the comments and even entire groups here on Reddit for Marianne Williamson are, really, REALLY negative!!! 

It's like the two options are complain or talk about the old ""orange dough man"". 

I really dislike ALL of the candidates! Like do not like ANY of them. =( ... 

I want to have a discussion with some, even a slight glimmer of hope in it for the 2024 POTUS election. But, Marianne, she's even a bit too liberal for me? Too wealthy? Her point of view. We need change, we need to not keep doing what we are doing. Money isn't going to fix anything, too much debt, too much negative money dragging the US down like we are stuck in cement boots. 

Okay me that was really abstract... again. \*blerg\* ... Good \*jorb\*... B4N",734,
157,Lazy_Gringo3,Bernie is older than Biden and was rejected by Dem voters 2-1 despite outspending Biden 50-1 and having massive Putin troll support..  he is for cutting the Pentagon in  half at a time when we face both Putin in real war and China in potential future war.,255,
158,Roughneck16,">Why AOC? 5 words: GREEN NEW DEAL CLIMATE ACTION!!!

Presidents aren't dictators. She'd need congressional approval.

Also, the US only produces a paltry 15% of the world's greenhouse gases. Even the most dramatic changes to our emissions standards would put a tiny dent in global warming.",289,
159,Lazy_Gringo3,"Matthew McConaughey might run as a indie democrat. If so, he wins TX, FL and 40+ other states as a democrat and that ends Maga and huge partisan divides.  If he doesnt run then Gavin Newsom is the best.    and on the GOP side, Liz Cheney.

AOC would not win outside VT and OR if she ran,  She has lost a massive amount of her initial popularity due to huge blunders like defund police, banning fracking, massive socialist programs and voting against Ukraine aid.   She has her place and her voice, but she is not a viable state or national candidate.  She could not sin the senate in NY for instance,  de Blasio just retired and Eric adams won.  Even NYC has rejected the overly woke.",684,
160,Visible_Music8940,"Two words: Chuck Norris.

Slightly more seriously,  Jimmy Carter.

Actually serious, Joe Biden and Kamala Harris. They may be boring, but if you think AOC or Beto or almost anyone else could have done more over the last two years given the restraints they've had, split senate, conservative judges,  COVID 19, war in Ukraine, and strained alliances abroad, your faith is probably misplaced. 

Moreover,  continuity in government matters. AOC or anyone else would have to hire an entirely new staff, and one almost certainly less experienced.",541,
161,Lazy_Gringo3,"Beto needs to stay in texas and win there.   it will be close but he can do it.  if so he need only concentrate on TX, he was a poor national candidate too.  Matthew McConaughey is the Texan for president we need.",213,
162,Trick-Needleworker41,"Only way to stop the red wave and one that will win isn't even in politics.  He might do it, if he was urged, and would be a good moderate candidate if he did run.  That is no other than the Rock.  If he ever did run, he would win.

Just like I say Bernie would have won in 2016 if it wasnt for the crooked dems pushing for hillary.  Same way the dems pushed for Biden over Bernie in 2020.  And now we have the least popular president in history.  Rock will be a solid candidate if he decided to run.  He did voice his opinion on TMT in Hawaii, so he might do it if prompted.",575,
163,OverallGamer696,Bernie sanders a little old to be president. rn he’s 81.,56,
164,Uva_Be,"What do folks think about Al Gore running for POTUS in 2024?

I didn't consider him when I wrote my list of dream candidates last year. But, the importance and cost of lack of climate action and how climate change relates to world security because WATER and FOOD security and climate change crop failures. I'd seriously vote for Al Gore. At 74 I'd prefer him 1,000% more than Biden running again. The Bill Clinton/Gore financial budget stands for itself. Even if undermined by bills and actions Reagan put into effect/destroyed that they couldn't replace or fix.   
I have no clue who should be his running mate for VP.   
Andrew Yang or Elizabeth Warren maybe?   
Any thoughts?",678,
165,,Would much rather see katie porter as pres. AOC would be kind of a useless president imo. I think shes fine where she is.,121,
166,3bas3,"Progressivism is a tough sell in America. There are still many boomers that while not right wing, they live as centrists. They are the battlefield. This cycle is not a cycle of ideas. It’s a cycle of democracy vs. autocracy. And it’s gonna take the largest coalition with a core list of values. Biden centrists don’t push the progressive agenda but they are at the minimum pro-environment. Pro-women’s-health etc… Republicans get in? Look at Florida and what they did with the SCOTUS. Thats what will happen. So, the question is, are you in favor of a republic or are you in favor of autocracy. That’s sadly the choice.",619,
167,wrenvoltaire,"In terms of best team that could realistically be elected, it’s Gretchen Whitmer/Cory Booker for me.",100,
168,Uva_Be,"Biden should not only step down, but, because he knows so many people in politics he should have a team in his administration select a handful of good candidates to replace him. 

And that should happen sooner, rather than later so the people get a chance to get to know these hopefully younger than Bernie Sanders and Elizabeth Warren, DNC candidate recommendations.",367,
169,Uva_Be,"After the debate last night, June 27th, 2024, I slept on it, I confess I even prayed about it a few times. And this is how I woke up. 

  
Dear DNC 

Governor Gretchen Whitmer and Senator Cory Booker 

POTUS and VP team, please. 



A great Governor and the biggest heart in the US Senate to represent us.



P.s. IMHO Vice President Kamala Harris would make a great attorney general of the united states.",405,
170,Sensitive-Bid-9531,Your dream is my nightmare.  I love you still. I used to think like you until I graduated and had to pay taxes. I realized that the US government was not going to make my life better unless I was Kamala Harris or HIllary Clinton. The ordinary citizen under socialism has no way to thrive.,288,
171,,"Politics isn't a childish game, you need people who can win economic wars and control terrorism, people who can negotiate with putin and X Jinpingi!! You think AOC can do that? All she has to say is free everything, free healthcare student loan forgiveness subsidized xyc ...",275,
172,rlivenmore,"Climate action is a scare tactic to try to force socialist legislation. If implemented like leftists want, it would reduce 2 billion people from middle class to poor and 2 billion others who are already poor to not able to survive. And there is no assurance that any such legislation would effect the climate.",309,
173,rlivenmore,Any candidate that wants to win should propose ending personal US income tax filings and abolishing the IRS. That doesn’t stop income taxes. There’s other ways to collect taxes.,177,
174,rlivenmore,"It’s no personal income tax paperwork, there can still be personal income taxes, however that should be stopped too. A little history here. Personal income taxes began during the First World War of 1914 to 1918. It was an emergency wartime measure. But guess what? Congress never repealed income taxes when the war ended. We are pretty much at peace now. There is no need for an income tax. If the humongous US government really needs the money it can be recovered with a value added tax. The US is based on freedom and it works great for prosperity and wealth and is inconsistent with Founding principles. Filling out complicated forms requiring numerous hours of labor should be abolished. Any candidate who proposes this will receive huge support. (Are you listening, Trump Election Committee?)",797,
175,Richnazdy,RFKJR,5,
176,rlivenmore,World population has surpassed 8 billion.,41,
177,Consistent_Drop1006,Gimme a candidate to reform immigration (expand) and slowly dismantle more tariffs and I’m 100% on board,104,
178,Aggressive-Crazy22,you’re an idiot,15,
179,SunnyNowAndThen,"My dream candidate is Joe Biden.  The media has not done a great job of covering him, but people who know Washington and how things work or don't work there know that his getting ANY of the bills passed that he wanted past is miraculous.  This is what a politician with exceptional experience can do.  He has the friends, the favors to call in, the arms to twist - all that is really needed to get things done there.  He will go down as one of the GREATEST presidents.  I hope all democrats will take time to look fairly at him.  I feel sure no GOP member will.",561,
180,Hilldog2020,"If you arnt putting POC candidates as both, you are racist , sorry not sorry",76,
181,Uva_Be,"After the cringe that was the Republican debate. I've kept my ears pricked while cat napping. Listening for anyone who would actual get work done for the American people. And today, Nov 16th, 2023, my favorite candidate in the race is Marianne Williamson. #Vote2024",265,
182,TargetNo9243,AOC?? You gotta be kidding!!!,29,
183,Uva_Be,"Yeah, I know, that's why he is VP and in the 3rd group of my hypothetical POTUS VP dream teams.",95,
184,Uva_Be,"When I look at US statistics I'm often amazed at how well Bernie is doing as senator for the people in Vermont. 

I don't know what you are talking about with the 'outspending Biden 50-1.' Could you please find some links to more specific data, I would like to read it. 

For example, on the line about cutting the Pentagon by half? I didn't find any facts to support that. I see a bill for a 10% cut and it looks very good to me. 

https://www.markey.senate.gov/news/press-releases/markey-sanders-initiative-to-cut-pentagon-budget-by-10-secures-support-of-half-of-us-senate-democratic-caucus",592,
185,Trick-Needleworker41,"You talking too much facts for them to comprehend.  Meanwhile, they be using their chinese made Iphones, Ipads, and nike shoes which greatly pollutes the environment, not to mention human right issues against the chinese muslims there.  Before we talk about ourselves, we must hold China and India responsible as they are the ones destroying our environment more so than the unites states.",389,
